{
  "protocol_version": "0.1",
  "source_term": "职教出海",
  "target_term": "international development of vocational education",
  "type": "policy_term",
  "status": "approved",
  "priority": "user_confirmed",
  "scope": "external publicity / education cooperation",
  "forbidden_targets": ["vocational education going overseas"],
  "notes": "Avoid literal slogan translation.",
  "provenance": [
    {
      "type": "user_decision",
      "date": "2026-06-26"
    }
  ]
}
